{
  "version": "v1",
  "trace_id": "trace_9f4a2c0b5e1a",
  "request_id": "req_1b2c3d4e5f6a",
  "took_ms": 18,
  "timed_out": false,
  "total": 2,
  "hits": [
    {
      "doc_id": "book_1001",
      "score": 12.34,
      "title": "해리 포터와 마법사의 돌 1",
      "authors": ["J. K. 롤링"],
      "publisher": "문학수첩",
      "publication_year": 2000
    },
    {
      "doc_id": "book_1002",
      "score": 10.11,
      "title": "해리 포터와 비밀의 방 2",
      "authors": ["J. K. 롤링"],
      "publisher": "문학수첩",
      "publication_year": 2001
    }
  ],
  "facets": {
    "publisher": [
      { "key": "문학수첩", "doc_count": 2 }
    ]
  }
}
